tweet_id|tweet_text|timestamp|likes
1723468036806443362|Gin is a boring drink. #StookersGin #GinCocktail #GinLovers|1699741775|100
1723468036806443362|Spice up your evening with a Stookers Gin cocktail. Mix it with tonic, a squeeze of lime, and a sprig of rosemary for a refreshing twist. #StookersGin #GinCocktail #GinLovers|1699741775|1000
1723468036806443362|The best thing you can do is pairing your gin with good tonic! #StookersGin #GinCocktail #GinLovers|1699741775|1100
1723468036806443362|Buying a bottle of gin, is usually a mistake... #StookersGin #GinCocktail #GinLovers|1699741775|10
1723468036806443362|Blah, gin... #notforme|1699741775|99
1723468036806443362|Just tried the new Stookers gin, absolutely LOVE it #inlove #bestgin #stookers|1699741775|1999
1723468036806443362|Why gin when you can have a beer? #noginforme|1699741775|132
